<?xml version="1.0" encoding="UTF-8"?>
<table class="org.mifos.xyz" name="center" resourcebundle="resource"
		xmlns="http://www.aditi.com" 
		xmlns:xsi="http://www.w3.org/2001/XMLSchema-instance" 
		xsi:schemaLocation="http://www.aditi.com tabletag.xsd ">
<path key="centerSearch" forwardkey="search_success" action="/centerCustAction.do"/> 
<pagerequirements numbersrequired="true" bluelinerequired="true" headingrequired="false" blanklinerequired="false" valignnumbers="true"/>  
  
<row>
	<column label="" labeltype="string" boldlabel="false" type="text" >
		<displayname>
			<fragment-name name="parentOfficeName" type="method"/>
		</displayname>
	</column>
	<column label="/" labeltype="string" boldlabel="true" type="link" action="GroupAction.do" >
		<displayname bold="true">
			<fragment-name name="centerName" type="method"/>
		</displayname>
		<parameters>
			<parameter name="parentOfficeId" value="parentOfficeId" valuetype="method"/>
			<parameter name="centerSystemId" value="centerSystemId" valuetype="method"/>
			<parameter name="centerName" value="centerName" valuetype="method"/>
			<parameter name="method" value="confirmParentTransfer" valuetype="string"/>
		</parameters>
	</column>
</row>
  
</table>